[
  {
    "id": "hold_the_line",
    "name": "Hold the Line",
    "type": "utility",
    "range": "self",
    "target": "self",
    "power": 0,
    "element": "none",
    "cooldown": 4,
    "riders": [
      {
        "status": "bulwark",
        "chance": 10000,
        "duration": 3,
        "on": "self"
      }
    ],
    "owner": "shieldwarden"
  },
  {
    "id": "shield_bash",
    "name": "Shield Bash",
    "type": "physical",
    "range": "melee",
    "target": "enemy",
    "power": 12000,
    "element": "none",
    "cooldown": 3,
    "riders": [
      {
        "status": "shock",
        "chance": 2500,
        "duration": 1,
        "on": "target"
      }
    ],
    "owner": "shieldwarden"
  },
  {
    "id": "cleave",
    "name": "Cleave",
    "type": "physical",
    "range": "melee",
    "target": "all_enemies",
    "power": 7500,
    "element": "none",
    "cooldown": 4,
    "riders": [],
    "owner": "huscarl"
  },
  {
    "id": "hearth_strike",
    "name": "Hearth Strike",
    "type": "physical",
    "range": "melee",
    "target": "enemy",
    "power": 16000,
    "element": "fire",
    "cooldown": 3,
    "riders": [
      {
        "status": "burn",
        "chance": 4000,
        "duration": 3,
        "on": "target"
      }
    ],
    "owner": "huscarl"
  },
  {
    "id": "pinning_shot",
    "name": "Pinning Shot",
    "type": "physical",
    "range": "ranged",
    "target": "enemy",
    "power": 13000,
    "element": "none",
    "cooldown": 3,
    "riders": [
      {
        "status": "chill",
        "chance": 5000,
        "duration": 2,
        "on": "target"
      }
    ],
    "owner": "hunter"
  },
  {
    "id": "volley",
    "name": "Volley",
    "type": "physical",
    "range": "ranged",
    "target": "all_enemies",
    "power": 6500,
    "element": "none",
    "cooldown": 4,
    "riders": [],
    "owner": "hunter"
  },
  {
    "id": "hearth_light",
    "name": "Hearth Light",
    "type": "heal",
    "range": "ranged",
    "target": "ally",
    "power": 12000,
    "element": "none",
    "cooldown": 2,
    "riders": [],
    "owner": "hearthkeeper"
  },
  {
    "id": "warm_embers",
    "name": "Warm Embers",
    "type": "utility",
    "range": "ranged",
    "target": "all_allies",
    "power": 0,
    "element": "none",
    "cooldown": 5,
    "riders": [
      {
        "status": "mend",
        "chance": 10000,
        "duration": 3,
        "on": "target"
      }
    ],
    "owner": "hearthkeeper"
  },
  {
    "id": "frenzy",
    "name": "Frenzy",
    "type": "utility",
    "range": "self",
    "target": "self",
    "power": 0,
    "element": "none",
    "cooldown": 4,
    "riders": [
      {
        "status": "fury",
        "chance": 10000,
        "duration": 3,
        "on": "self"
      }
    ],
    "owner": "berserker"
  },
  {
    "id": "rend",
    "name": "Rend",
    "type": "physical",
    "range": "melee",
    "target": "enemy",
    "power": 18000,
    "element": "none",
    "cooldown": 3,
    "riders": [
      {
        "status": "mark",
        "chance": 6000,
        "duration": 3,
        "on": "target"
      }
    ],
    "owner": "berserker"
  },
  {
    "id": "maul",
    "name": "Maul",
    "type": "physical",
    "range": "melee",
    "target": "enemy",
    "power": 26000,
    "element": "none",
    "cooldown": 5,
    "riders": [],
    "owner": "berserker"
  },
  {
    "id": "valhalla_strike",
    "name": "Valhalla Strike",
    "type": "physical",
    "range": "melee",
    "target": "enemy",
    "power": 14000,
    "element": "lightning",
    "cooldown": 3,
    "riders": [
      {
        "status": "shock",
        "chance": 2000,
        "duration": 1,
        "on": "target"
      }
    ],
    "owner": "einherjar"
  },
  {
    "id": "rally",
    "name": "Rally",
    "type": "utility",
    "range": "ranged",
    "target": "all_allies",
    "power": 0,
    "element": "none",
    "cooldown": 5,
    "riders": [
      {
        "status": "fury",
        "chance": 10000,
        "duration": 2,
        "on": "target"
      }
    ],
    "owner": "einherjar"
  },
  {
    "id": "chain_lightning",
    "name": "Chain Lightning",
    "type": "magic",
    "range": "ranged",
    "target": "all_enemies",
    "power": 7500,
    "element": "lightning",
    "cooldown": 4,
    "riders": [],
    "owner": "stormcaller"
  },
  {
    "id": "thunderclap",
    "name": "Thunderclap",
    "type": "magic",
    "range": "ranged",
    "target": "enemy",
    "power": 15000,
    "element": "lightning",
    "cooldown": 3,
    "riders": [
      {
        "status": "shock",
        "chance": 3500,
        "duration": 1,
        "on": "target"
      }
    ],
    "owner": "stormcaller"
  },
  {
    "id": "battle_hymn",
    "name": "Battle Hymn",
    "type": "utility",
    "range": "ranged",
    "target": "all_allies",
    "power": 0,
    "element": "none",
    "cooldown": 5,
    "riders": [
      {
        "status": "fury",
        "chance": 10000,
        "duration": 3,
        "on": "target"
      }
    ],
    "owner": "skald"
  },
  {
    "id": "mending_verse",
    "name": "Mending Verse",
    "type": "heal",
    "range": "ranged",
    "target": "all_allies",
    "power": 7000,
    "element": "none",
    "cooldown": 4,
    "riders": [],
    "owner": "skald"
  },
  {
    "id": "dive",
    "name": "Dive",
    "type": "physical",
    "range": "ranged",
    "target": "enemy",
    "power": 16000,
    "element": "none",
    "cooldown": 3,
    "riders": [],
    "owner": "skyrider"
  },
  {
    "id": "pinion_volley",
    "name": "Pinion Volley",
    "type": "physical",
    "range": "ranged",
    "target": "all_enemies",
    "power": 6500,
    "element": "none",
    "cooldown": 4,
    "riders": [],
    "owner": "skyrider"
  },
  {
    "id": "choose_the_slain",
    "name": "Choose the Slain",
    "type": "physical",
    "range": "melee",
    "target": "enemy",
    "power": 22000,
    "element": "none",
    "cooldown": 3,
    "riders": [],
    "owner": "valkyrie"
  },
  {
    "id": "wings_shield",
    "name": "Wings' Shield",
    "type": "utility",
    "range": "ranged",
    "target": "all_allies",
    "power": 0,
    "element": "none",
    "cooldown": 5,
    "riders": [
      {
        "status": "bulwark",
        "chance": 10000,
        "duration": 3,
        "on": "target"
      }
    ],
    "owner": "valkyrie"
  },
  {
    "id": "storm_rend",
    "name": "Storm Rend",
    "type": "physical",
    "range": "melee",
    "target": "all_enemies",
    "power": 8500,
    "element": "lightning",
    "cooldown": 4,
    "riders": [],
    "owner": "valkyrie"
  },
  {
    "id": "cold_grip",
    "name": "Cold Grip",
    "type": "physical",
    "range": "melee",
    "target": "enemy",
    "power": 10000,
    "element": "frost",
    "cooldown": 3,
    "riders": [
      {
        "status": "chill",
        "chance": 6000,
        "duration": 2,
        "on": "target"
      }
    ],
    "owner": "draugr_knight"
  },
  {
    "id": "undying_will",
    "name": "Undying Will",
    "type": "utility",
    "range": "self",
    "target": "self",
    "power": 0,
    "element": "none",
    "cooldown": 5,
    "riders": [
      {
        "status": "bulwark",
        "chance": 10000,
        "duration": 3,
        "on": "self"
      },
      {
        "status": "mend",
        "chance": 10000,
        "duration": 3,
        "on": "self"
      }
    ],
    "owner": "draugr_knight"
  },
  {
    "id": "hex",
    "name": "Hex",
    "type": "magic",
    "range": "ranged",
    "target": "enemy",
    "power": 8000,
    "element": "none",
    "cooldown": 3,
    "riders": [
      {
        "status": "mark",
        "chance": 9000,
        "duration": 3,
        "on": "target"
      }
    ],
    "owner": "volva"
  },
  {
    "id": "frostbite",
    "name": "Frostbite",
    "type": "magic",
    "range": "ranged",
    "target": "enemy",
    "power": 14000,
    "element": "frost",
    "cooldown": 3,
    "riders": [
      {
        "status": "chill",
        "chance": 6000,
        "duration": 2,
        "on": "target"
      }
    ],
    "owner": "volva"
  },
  {
    "id": "gnaw",
    "name": "Gnaw",
    "type": "physical",
    "range": "melee",
    "target": "enemy",
    "power": 13000,
    "element": "none",
    "cooldown": 3,
    "riders": [
      {
        "status": "mark",
        "chance": 5000,
        "duration": 3,
        "on": "target"
      }
    ],
    "owner": "ghoul_reaver"
  },
  {
    "id": "carrion_feast",
    "name": "Carrion Feast",
    "type": "physical",
    "range": "melee",
    "target": "enemy",
    "power": 18000,
    "element": "none",
    "cooldown": 4,
    "riders": [],
    "lifestealBp": 5000,
    "owner": "ghoul_reaver"
  },
  {
    "id": "frostmend",
    "name": "Frostmend",
    "type": "heal",
    "range": "ranged",
    "target": "ally",
    "power": 11000,
    "element": "frost",
    "cooldown": 3,
    "riders": [
      {
        "status": "bulwark",
        "chance": 10000,
        "duration": 2,
        "on": "target"
      }
    ],
    "owner": "rime_mender"
  },
  {
    "id": "mist_veil",
    "name": "Mist Veil",
    "type": "utility",
    "range": "ranged",
    "target": "all_allies",
    "power": 0,
    "element": "none",
    "cooldown": 5,
    "riders": [
      {
        "status": "bulwark",
        "chance": 10000,
        "duration": 3,
        "on": "target"
      }
    ],
    "owner": "rime_mender"
  },
  {
    "id": "soul_arrow",
    "name": "Soul Arrow",
    "type": "physical",
    "range": "ranged",
    "target": "enemy",
    "power": 20000,
    "element": "none",
    "cooldown": 3,
    "riders": [],
    "owner": "wraith_hunter"
  },
  {
    "id": "deaths_chill",
    "name": "Death's Chill",
    "type": "physical",
    "range": "ranged",
    "target": "all_enemies",
    "power": 5500,
    "element": "frost",
    "cooldown": 5,
    "riders": [
      {
        "status": "chill",
        "chance": 4000,
        "duration": 2,
        "on": "target"
      }
    ],
    "owner": "wraith_hunter"
  },
  {